{
  "year": 2024,
  "title": "March Madness Pool 2024",
  "gameDates": [
    "20240319",
    "20240320",
    "20240321",
    "20240322",
    "20240323",
    "20240324",
    "20240325",
    "20240326",
    "20240327",
    "20240328",
    "20240329",
    "20240330",
    "20240331",
    "20240402",
    "20240403",
    "20240404",
    "20240406",
    "20240407",
    "20240409"
  ],
  "players": [
    {
      "name": "Toom/PJ",
      "color": "#d32f2f"
    },
    {
      "name": "Pat",
      "color": "#1565c0"
    },
    {
      "name": "Brennan",
      "color": "#2e7d32"
    },
    {
      "name": "Brian",
      "color": "#ef6c00"
    },
    {
      "name": "Glenn",
      "color": "#7b1fa2"
    },
    {
      "name": "Mac",
      "color": "#f5c518"
    },
    {
      "name": "John",
      "color": "#455a64"
    },
    {
      "name": "Mike",
      "color": "#4e342e"
    }
  ],
  "finalFourMatchups": [
    [
      "Midwest",
      "South"
    ],
    [
      "East",
      "West"
    ]
  ],
  "firstFour": [
    {
      "team1": "Montana State",
      "team1EspnId": "147",
      "team1Abbrev": "MTST",
      "team2": "Grambling",
      "team2EspnId": "2755",
      "team2Abbrev": "GRAM",
      "region": "Midwest",
      "seed": 16,
      "winner": "Grambling"
    },
    {
      "team1": "Virginia",
      "team1EspnId": "258",
      "team1Abbrev": "UVA",
      "team2": "Colorado State",
      "team2EspnId": "36",
      "team2Abbrev": "CSU",
      "region": "Midwest",
      "seed": 10,
      "winner": "Colorado State"
    },
    {
      "team1": "Howard",
      "team1EspnId": "47",
      "team1Abbrev": "HOW",
      "team2": "Wagner",
      "team2EspnId": "2681",
      "team2Abbrev": "WAG",
      "region": "West",
      "seed": 16,
      "winner": "Wagner"
    },
    {
      "team1": "Boise State",
      "team1EspnId": "68",
      "team1Abbrev": "BOIS",
      "team2": "Colorado",
      "team2EspnId": "38",
      "team2Abbrev": "COLO",
      "region": "South",
      "seed": 10,
      "winner": "Colorado"
    }
  ],
  "regions": {
    "South": [
      {
        "seed": 1,
        "name": "Houston",
        "espnId": "248",
        "abbrev": "HOU",
        "owner": "Pat",
        "firstFour": false
      },
      {
        "seed": 2,
        "name": "Marquette",
        "espnId": "269",
        "abbrev": "MARQ",
        "owner": "Brennan",
        "firstFour": false
      },
      {
        "seed": 3,
        "name": "Kentucky",
        "espnId": "96",
        "abbrev": "UK",
        "owner": "Brian",
        "firstFour": false
      },
      {
        "seed": 4,
        "name": "Duke",
        "espnId": "150",
        "abbrev": "DUKE",
        "owner": "John",
        "firstFour": false
      },
      {
        "seed": 5,
        "name": "Wisconsin",
        "espnId": "275",
        "abbrev": "WIS",
        "owner": "Toom/PJ",
        "firstFour": false
      },
      {
        "seed": 6,
        "name": "Texas Tech",
        "espnId": "2641",
        "abbrev": "TTU",
        "owner": "John",
        "firstFour": false
      },
      {
        "seed": 7,
        "name": "Florida",
        "espnId": "57",
        "abbrev": "FLA",
        "owner": "Brennan",
        "firstFour": false
      },
      {
        "seed": 8,
        "name": "Nebraska",
        "espnId": "158",
        "abbrev": "NEB",
        "owner": "Pat",
        "firstFour": false
      },
      {
        "seed": 9,
        "name": "Texas A&M",
        "espnId": "245",
        "abbrev": "TA&M",
        "owner": "Mac",
        "firstFour": false
      },
      {
        "seed": 10,
        "name": "Colorado",
        "espnId": "38",
        "abbrev": "COLO",
        "owner": "Pat",
        "firstFour": true
      },
      {
        "seed": 11,
        "name": "NC State",
        "espnId": "152",
        "abbrev": "NCSU",
        "owner": "Mac",
        "firstFour": false
      },
      {
        "seed": 12,
        "name": "James Madison",
        "espnId": "256",
        "abbrev": "JMU",
        "owner": "Mike",
        "firstFour": false
      },
      {
        "seed": 13,
        "name": "Vermont",
        "espnId": "261",
        "abbrev": "UVM",
        "owner": "Glenn",
        "firstFour": false
      },
      {
        "seed": 14,
        "name": "Oakland",
        "espnId": "2473",
        "abbrev": "OAK",
        "owner": "John",
        "firstFour": false
      },
      {
        "seed": 15,
        "name": "Western Kentucky",
        "espnId": "98",
        "abbrev": "WKU",
        "owner": "Mike",
        "firstFour": false
      },
      {
        "seed": 16,
        "name": "Longwood",
        "espnId": "2344",
        "abbrev": "LONG",
        "owner": "Brennan",
        "firstFour": false
      }
    ],
    "East": [
      {
        "seed": 1,
        "name": "UConn",
        "espnId": "41",
        "abbrev": "CONN",
        "owner": "Toom/PJ",
        "firstFour": false
      },
      {
        "seed": 2,
        "name": "Iowa State",
        "espnId": "66",
        "abbrev": "ISU",
        "owner": "Mac",
        "firstFour": false
      },
      {
        "seed": 3,
        "name": "Illinois",
        "espnId": "356",
        "abbrev": "ILL",
        "owner": "Pat",
        "firstFour": false
      },
      {
        "seed": 4,
        "name": "Auburn",
        "espnId": "2",
        "abbrev": "AUB",
        "owner": "Mike",
        "firstFour": false
      },
      {
        "seed": 5,
        "name": "San Diego State",
        "espnId": "21",
        "abbrev": "SDSU",
        "owner": "John",
        "firstFour": false
      },
      {
        "seed": 6,
        "name": "BYU",
        "espnId": "252",
        "abbrev": "BYU",
        "owner": "Brennan",
        "firstFour": false
      },
      {
        "seed": 7,
        "name": "Washington State",
        "espnId": "265",
        "abbrev": "WSU",
        "owner": "Brennan",
        "firstFour": false
      },
      {
        "seed": 8,
        "name": "Florida Atlantic",
        "espnId": "2226",
        "abbrev": "FAU",
        "owner": "Glenn",
        "firstFour": false
      },
      {
        "seed": 9,
        "name": "Northwestern",
        "espnId": "77",
        "abbrev": "NU",
        "owner": "Mac",
        "firstFour": false
      },
      {
        "seed": 10,
        "name": "Drake",
        "espnId": "2181",
        "abbrev": "DRKE",
        "owner": "Toom/PJ",
        "firstFour": false
      },
      {
        "seed": 11,
        "name": "Duquesne",
        "espnId": "2184",
        "abbrev": "DUQ",
        "owner": "Brian",
        "firstFour": false
      },
      {
        "seed": 12,
        "name": "UAB",
        "espnId": "5",
        "abbrev": "UAB",
        "owner": "Toom/PJ",
        "firstFour": false
      },
      {
        "seed": 13,
        "name": "Yale",
        "espnId": "43",
        "abbrev": "YALE",
        "owner": "Glenn",
        "firstFour": false
      },
      {
        "seed": 14,
        "name": "Morehead State",
        "espnId": "2413",
        "abbrev": "MORE",
        "owner": "Mac",
        "firstFour": false
      },
      {
        "seed": 15,
        "name": "South Dakota State",
        "espnId": "2571",
        "abbrev": "SDST",
        "owner": "Glenn",
        "firstFour": false
      },
      {
        "seed": 16,
        "name": "Stetson",
        "espnId": "56",
        "abbrev": "STET",
        "owner": "Toom/PJ",
        "firstFour": false
      }
    ],
    "Midwest": [
      {
        "seed": 1,
        "name": "Purdue",
        "espnId": "2509",
        "abbrev": "PUR",
        "owner": "Brennan",
        "firstFour": false
      },
      {
        "seed": 2,
        "name": "Tennessee",
        "espnId": "2633",
        "abbrev": "TENN",
        "owner": "Glenn",
        "firstFour": false
      },
      {
        "seed": 3,
        "name": "Creighton",
        "espnId": "156",
        "abbrev": "CREI",
        "owner": "John",
        "firstFour": false
      },
      {
        "seed": 4,
        "name": "Kansas",
        "espnId": "2305",
        "abbrev": "KU",
        "owner": "Mac",
        "firstFour": false
      },
      {
        "seed": 5,
        "name": "Gonzaga",
        "espnId": "2250",
        "abbrev": "GONZ",
        "owner": "Glenn",
        "firstFour": false
      },
      {
        "seed": 6,
        "name": "South Carolina",
        "espnId": "2579",
        "abbrev": "SC",
        "owner": "Brian",
        "firstFour": false
      },
      {
        "seed": 7,
        "name": "Texas",
        "espnId": "251",
        "abbrev": "TEX",
        "owner": "Brennan",
        "firstFour": false
      },
      {
        "seed": 8,
        "name": "Utah State",
        "espnId": "328",
        "abbrev": "USU",
        "owner": "Toom/PJ",
        "firstFour": false
      },
      {
        "seed": 9,
        "name": "TCU",
        "espnId": "2628",
        "abbrev": "TCU",
        "owner": "Pat",
        "firstFour": false
      },
      {
        "seed": 10,
        "name": "Colorado State",
        "espnId": "36",
        "abbrev": "CSU",
        "owner": "Mike",
        "firstFour": true
      },
      {
        "seed": 11,
        "name": "Oregon",
        "espnId": "2483",
        "abbrev": "ORE",
        "owner": "Pat",
        "firstFour": false
      },
      {
        "seed": 12,
        "name": "McNeese",
        "espnId": "2377",
        "abbrev": "MCN",
        "owner": "Mike",
        "firstFour": false
      },
      {
        "seed": 13,
        "name": "Samford",
        "espnId": "2535",
        "abbrev": "SAM",
        "owner": "Brian",
        "firstFour": false
      },
      {
        "seed": 14,
        "name": "Akron",
        "espnId": "2006",
        "abbrev": "AKR",
        "owner": "Glenn",
        "firstFour": false
      },
      {
        "seed": 15,
        "name": "Saint Peter's",
        "espnId": "2612",
        "abbrev": "SPU",
        "owner": "Mike",